[
  {
    "domain": "centene_dme_orthotics_prosthetics",
    "document_type": "governing_policy",
    "policy_title": "Clinical Policy CP.MP.48: Neuromuscular and Peroneal Nerve Electrical Stimulation (NMES)",
    "policy_version": "Revision 04/26",
    "version_status": "current_2026_verified",
    "source_file": "rulebook_collection/domains/centene_dme_orthotics_prosthetics/policy_pdfs/current_2026/CP.MP.48.pdf",
    "source_url": "https://www.centene.com/content/dam/centene/policies/clinical-policies/CP.MP.48.pdf",
    "rule_id": "RULE-DME-048-001",
    "source_page": {
      "physical_page": 1,
      "printed_page": "Page 1 of 7"
    },
    "source_section": "Policy/Criteria - Section I NMES for Disuse Atrophy",
    "source_quote": "neuromuscular electrical stimulation (NMES) is medically necessary when used as one component of a comprehensive rehab program for the treatment of disuse atrophy when the nerve supply to the atrophied muscle is intact and has any of the following atrophy indications: A. Contractures due to scarring of soft tissue (e.g., burn lesions); B. Previous casting or splinting of a limb; C. Major knee surgery with failure to respond to physical therapy; D. Recent hip replacement and NMES will be used until physical therapy begins.",
    "clinical_service_or_procedure": "Neuromuscular Electrical Stimulation (NMES) for Disuse Atrophy (HCPCS E0745)",
    "rule_type": "clinical_indication",
    "conditions": {
      "operator": "ALL_OF",
      "criteria": [
        {
          "condition_id": "COND-DME-048-001-A",
          "description": "Part of a comprehensive rehabilitation program",
          "parameter": "comprehensive_rehab_program",
          "comparator": "EQUALS",
          "value": "TRUE"
        },
        {
          "condition_id": "COND-DME-048-001-B",
          "description": "Nerve supply to the atrophied muscle is intact",
          "parameter": "nerve_supply_intact",
          "comparator": "EQUALS",
          "value": "TRUE"
        },
        {
          "condition_id": "COND-DME-048-001-C",
          "description": "Atrophy indication: soft tissue contractures/burn, previous cast/splint, major knee surgery failed PT, or recent hip replacement",
          "parameter": "disuse_atrophy_qualifying_indication",
          "comparator": "IS_PRESENT"
        }
      ]
    },
    "required_documentation": [
      "Physical therapy comprehensive rehabilitation plan",
      "Neurologic exam confirming intact peripheral nerve supply"
    ],
    "decision_effect": "INDICATED",
    "missing_information_behavior": "PEND_FOR_DOCUMENTATION",
    "human_review_required": false,
    "extraction_status": "DRAFT",
    "review_notes": "Indicated as one component of comprehensive rehab for qualifying disuse atrophy."
  },
  {
    "domain": "centene_dme_orthotics_prosthetics",
    "document_type": "governing_policy",
    "policy_title": "Clinical Policy CP.MP.48: Neuromuscular and Peroneal Nerve Electrical Stimulation (NMES)",
    "policy_version": "Revision 04/26",
    "version_status": "current_2026_verified",
    "source_file": "rulebook_collection/domains/centene_dme_orthotics_prosthetics/policy_pdfs/current_2026/CP.MP.48.pdf",
    "source_url": "https://www.centene.com/content/dam/centene/policies/clinical-policies/CP.MP.48.pdf",
    "rule_id": "RULE-DME-048-002",
    "source_page": {
      "physical_page": 1,
      "printed_page": "Page 1 of 7"
    },
    "source_section": "Policy/Criteria - Section II FES for Spinal Cord Injury",
    "source_quote": "functional electrical stimulation (FES) is medically necessary for spinal cord injury (SCI) when all of the following criteria are met: A. The member/enrollee has brisk muscle contraction to stimulation and sensory perception of electrical stimulation sufficient for muscle contraction; B. At least six months have passed since recovery from spinal cord injury and restorative surgery; C. Member/enrollee is highly motivated, committed, and has the cognitive ability to use FES devices for walking; D. Successful completion of a training program consisting of at least 32 physical therapy sessions with the device over a three-month period; E. Member/enrollee demonstrates a willingness to use the device long-term;",
    "clinical_service_or_procedure": "Functional Electrical Stimulation (FES) for Spinal Cord Injury (HCPCS E0764, E0770)",
    "rule_type": "clinical_indication",
    "conditions": {
      "operator": "ALL_OF",
      "criteria": [
        {
          "condition_id": "COND-DME-048-002-A",
          "description": "Brisk muscle contraction and sensory perception to stimulation",
          "parameter": "brisk_muscle_contraction",
          "comparator": "EQUALS",
          "value": "TRUE"
        },
        {
          "condition_id": "COND-DME-048-002-B",
          "description": "\u2265 6 months post-recovery from SCI and restorative surgery",
          "parameter": "post_sci_duration_months",
          "comparator": "GREATER_THAN_OR_EQUAL",
          "value": 6,
          "unit": "months"
        },
        {
          "condition_id": "COND-DME-048-002-C",
          "description": "Completed training program of at least 32 PT sessions over 3 months",
          "parameter": "pt_training_sessions_completed",
          "comparator": "GREATER_THAN_OR_EQUAL",
          "value": 32,
          "unit": "sessions"
        },
        {
          "condition_id": "COND-DME-048-002-D",
          "description": "No contraindications: pacemaker, severe scoliosis/osteoporosis, skin disease/cancer, contracture, dysreflexia",
          "parameter": "fes_contraindications_present",
          "comparator": "EQUALS",
          "value": "FALSE"
        }
      ]
    },
    "required_documentation": [
      "Neurologic exam documenting brisk contraction",
      "Physical therapy log verifying \u226532 training sessions"
    ],
    "decision_effect": "INDICATED",
    "missing_information_behavior": "PEND_FOR_DOCUMENTATION",
    "human_review_required": false,
    "extraction_status": "DRAFT",
    "review_notes": "Mandatory 32-session training prerequisite and 6-month post-SCI stability."
  },
  {
    "domain": "centene_dme_orthotics_prosthetics",
    "document_type": "governing_policy",
    "policy_title": "Clinical Policy CP.MP.48: Neuromuscular and Peroneal Nerve Electrical Stimulation (NMES)",
    "policy_version": "Revision 04/26",
    "version_status": "current_2026_verified",
    "source_file": "rulebook_collection/domains/centene_dme_orthotics_prosthetics/policy_pdfs/current_2026/CP.MP.48.pdf",
    "source_url": "https://www.centene.com/content/dam/centene/policies/clinical-policies/CP.MP.48.pdf",
    "rule_id": "RULE-DME-048-003",
    "source_page": {
      "physical_page": 2,
      "printed_page": "Page 2 of 7"
    },
    "source_section": "Policy/Criteria - Section IV Peroneal Nerve Non-Covered",
    "source_quote": "peroneal nerve stimulators (e.g., NESS L300, NESS L300 Plus, L300 Go System, WalkAide, Odstock [ODFS\u00ae] Dropped Foot Stimulator) have not been proven safe and effective for any indication other than incomplete spinal cord injury, including, but not limited to: foot drop in cerebral palsy, multiple sclerosis, traumatic brain injury, or stroke.",
    "clinical_service_or_procedure": "Peroneal nerve stimulators (WalkAide, NESS L300) for Non-SCI Indications",
    "rule_type": "exclusion_criterion",
    "conditions": {
      "operator": "ANY_OF",
      "criteria": [
        {
          "condition_id": "COND-DME-048-003-A",
          "description": "Foot drop due to cerebral palsy",
          "parameter": "cerebral_palsy_foot_drop",
          "comparator": "EQUALS",
          "value": "TRUE"
        },
        {
          "condition_id": "COND-DME-048-003-B",
          "description": "Foot drop due to multiple sclerosis",
          "parameter": "multiple_sclerosis_foot_drop",
          "comparator": "EQUALS",
          "value": "TRUE"
        },
        {
          "condition_id": "COND-DME-048-003-C",
          "description": "Foot drop due to traumatic brain injury or stroke",
          "parameter": "tbi_or_stroke_foot_drop",
          "comparator": "EQUALS",
          "value": "TRUE"
        }
      ]
    },
    "decision_effect": "NOT_INDICATED",
    "missing_information_behavior": "FAIL_CONDITION",
    "human_review_required": false,
    "extraction_status": "DRAFT",
    "review_notes": "Peroneal nerve stimulators are unproven for non-incomplete SCI indications."
  }
]