[
  {
    "domain": "centene_dme_orthotics_prosthetics",
    "document_type": "governing_policy",
    "policy_title": "Clinical Policy CP.MP.203: Diaphragmatic/Phrenic Nerve Stimulation",
    "policy_version": "Revision 07/26",
    "version_status": "current_2026_verified",
    "source_file": "rulebook_collection/domains/centene_dme_orthotics_prosthetics/policy_pdfs/current_2026/CP.MP.203.pdf",
    "source_url": "https://www.centene.com/content/dam/centene/policies/clinical-policies/CP.MP.203.pdf",
    "rule_id": "RULE-DME-203-001",
    "source_page": {
      "physical_page": 1,
      "printed_page": "Page 1 of 7"
    },
    "source_section": "Policy/Criteria - Section I Avery Mark IV / Spirit",
    "source_quote": "diaphragmatic/phrenic nerve stimulation with the Mark IV\u2122 Breathing Pacemaker System or the Spirit Diaphragm Pacing Transmitter is medically necessary when all of the following are met: A. Stimulation is used as an alternative to mechanical ventilation for an individual with severe, chronic respiratory failure due to one of the following: 1. Upper cervical spinal cord injury (at or above the C3 vertebral level); 2. Central alveolar hypoventilation disorder;",
    "clinical_service_or_procedure": "Diaphragmatic/Phrenic Nerve Stimulation - Avery Mark IV / Spirit System (CPT 64575, 64585, 64590)",
    "rule_type": "clinical_indication",
    "conditions": {
      "operator": "ALL_OF",
      "criteria": [
        {
          "condition_id": "COND-DME-203-001-A",
          "description": "Severe chronic respiratory failure due to upper cervical SCI (\u2265C3) or central alveolar hypoventilation",
          "parameter": "avery_qualifying_respiratory_failure",
          "comparator": "IS_PRESENT"
        },
        {
          "condition_id": "COND-DME-203-001-B",
          "description": "Diaphragm movement visible under fluoroscopy",
          "parameter": "fluoroscopy_diaphragm_movement_confirmed",
          "comparator": "EQUALS",
          "value": "TRUE"
        },
        {
          "condition_id": "COND-DME-203-001-C",
          "description": "Intact phrenic nerve, lung, and diaphragm function",
          "parameter": "intact_phrenic_and_lung_function",
          "comparator": "EQUALS",
          "value": "TRUE"
        },
        {
          "condition_id": "COND-DME-203-001-D",
          "description": "Normal chest anatomy and consciousness to participate in rehabilitation",
          "parameter": "chest_anatomy_and_cognition_adequate",
          "comparator": "EQUALS",
          "value": "TRUE"
        }
      ]
    },
    "required_documentation": [
      "Fluoroscopy report demonstrating diaphragm excursion",
      "Phrenic nerve conduction study confirming viability"
    ],
    "decision_effect": "INDICATED",
    "missing_information_behavior": "PEND_FOR_DOCUMENTATION",
    "human_review_required": true,
    "extraction_status": "NEEDS_HUMAN_REVIEW",
    "review_notes": "Indicated as alternative to mechanical ventilation for upper cervical SCI (\u2265C3)."
  },
  {
    "domain": "centene_dme_orthotics_prosthetics",
    "document_type": "governing_policy",
    "policy_title": "Clinical Policy CP.MP.203: Diaphragmatic/Phrenic Nerve Stimulation",
    "policy_version": "Revision 07/26",
    "version_status": "current_2026_verified",
    "source_file": "rulebook_collection/domains/centene_dme_orthotics_prosthetics/policy_pdfs/current_2026/CP.MP.203.pdf",
    "source_url": "https://www.centene.com/content/dam/centene/policies/clinical-policies/CP.MP.203.pdf",
    "rule_id": "RULE-DME-203-002",
    "source_page": {
      "physical_page": 1,
      "printed_page": "Page 1 of 7"
    },
    "source_section": "Policy/Criteria - Section II NeuRx RA/4 System",
    "source_quote": "diaphragmatic/phrenic nerve stimulation with the NeuRx RA/4 Diaphragm Pacing System\u00ae is medically necessary when provided in accordance with the Humanitarian Device Exemption (HDE) specifications of the U.S Food and Drug Administration when all of the following are met: A. Stimulation is used as an alternative to mechanical ventilation for an individual with severe, chronic respiratory failure due to one of the following: 1. Amyotrophic lateral sclerosis (ALS);",
    "clinical_service_or_procedure": "NeuRx RA/4 Diaphragm Pacing System\u00ae under HDE (CPT 64575, 64585)",
    "rule_type": "clinical_indication",
    "conditions": {
      "operator": "ALL_OF",
      "criteria": [
        {
          "condition_id": "COND-DME-203-002-A",
          "description": "Alternative to mechanical ventilation for ALS (age \u226521, FVC \u226545%) OR upper cervical SCI (age \u226518)",
          "parameter": "neurx_qualifying_diagnosis",
          "comparator": "IS_PRESENT"
        },
        {
          "condition_id": "COND-DME-203-002-B",
          "description": "Diaphragm movement visible under fluoroscopy or ultrasound",
          "parameter": "imaging_diaphragm_movement_confirmed",
          "comparator": "EQUALS",
          "value": "TRUE"
        },
        {
          "condition_id": "COND-DME-203-002-C",
          "description": "Allows breathing without mechanical ventilator for at least 4 continuous hours/day",
          "parameter": "ventilator_free_hours_achievable",
          "comparator": "GREATER_THAN_OR_EQUAL",
          "value": 4,
          "unit": "hours"
        }
      ]
    },
    "required_documentation": [
      "ALS diagnosis and spirometry (FVC \u2265 45% predicted)",
      "Fluoroscopy/ultrasound report",
      "FDA HDE protocol adherence documentation"
    ],
    "decision_effect": "INDICATED",
    "missing_information_behavior": "PEND_FOR_DOCUMENTATION",
    "human_review_required": true,
    "extraction_status": "NEEDS_HUMAN_REVIEW",
    "review_notes": "FDA HDE protocol requirement: ALS requires age \u226521 and FVC \u226545%."
  },
  {
    "domain": "centene_dme_orthotics_prosthetics",
    "document_type": "governing_policy",
    "policy_title": "Clinical Policy CP.MP.203: Diaphragmatic/Phrenic Nerve Stimulation",
    "policy_version": "Revision 07/26",
    "version_status": "current_2026_verified",
    "source_file": "rulebook_collection/domains/centene_dme_orthotics_prosthetics/policy_pdfs/current_2026/CP.MP.203.pdf",
    "source_url": "https://www.centene.com/content/dam/centene/policies/clinical-policies/CP.MP.203.pdf",
    "rule_id": "RULE-DME-203-003",
    "source_page": {
      "physical_page": 2,
      "printed_page": "Page 2 of 7"
    },
    "source_section": "Policy/Criteria - Section III Central Sleep Apnea",
    "source_quote": "there is insufficient evidence to support the safety and efficacy of diaphragmatic/phrenic nerve stimulation for any other conditions, including but not limited to, central sleep apnea.",
    "clinical_service_or_procedure": "Phrenic Nerve Stimulation for Central Sleep Apnea (Remed\u00e9 System)",
    "rule_type": "exclusion_criterion",
    "conditions": {
      "operator": "SINGLE_CONDITION",
      "criteria": [
        {
          "condition_id": "COND-DME-203-003-A",
          "description": "Stimulation requested for central sleep apnea (Remed\u00e9 System) or unlisted condition",
          "parameter": "central_sleep_apnea_phrenic_stimulation",
          "comparator": "EQUALS",
          "value": "TRUE"
        }
      ]
    },
    "decision_effect": "NOT_INDICATED",
    "missing_information_behavior": "FAIL_CONDITION",
    "human_review_required": false,
    "extraction_status": "DRAFT",
    "review_notes": "Remed\u00e9 System for CSA is explicitly considered investigational/ unproven."
  }
]